{
  "schemaVersion": 1,
  "handoffId": "handoff_implement_1",
  "inputArtifact": { "path": "artifacts/handoffs/implement-1.json", "sha256": "905873e37073bc4dacc3d747ce7aa22bf99b016f4147b345a07627accd30df9c", "schemaId": "urn:squire:contracts:v1:phase-input" },
  "runId": "run_example01",
  "phase": "implement",
  "sessionId": "session-implement-01",
  "inputHead": "aaaaaaaaaaaaaaaaaaaaaaaaaaaaaaaaaaaaaaaa",
  "outputHead": "bbbbbbbbbbbbbbbbbbbbbbbbbbbbbbbbbbbbbbbb",
  "status": "pass",
  "artifacts": [
    { "path": "artifacts/implement/summary.json", "sha256": "5555555555555555555555555555555555555555555555555555555555555555", "mediaType": "application/json" }
  ],
  "evidence": [
    { "path": "evidence/implement/git-diff.txt", "sha256": "6666666666666666666666666666666666666666666666666666666666666666", "mediaType": "text/plain", "kind": "git" }
  ],
  "findings": [],
  "failures": [],
  "requestedTransition": { "toState": "reviewing", "reason": "phase_pass" },
  "completedAt": "2026-09-01T12:20:00Z"
}
